Start,End,Speaker,Text
0:00:00,0:00:12,Patricia,"La mesa no, no quiero mi zapato alright, algo mas para mañana? ah porque ahora Robin tiene pantalla, es cierto si, ahora ya da si porque allí no se puede comer, tiene la alfombra y todo"
0:00:14,0:00:18,SPEAKER_09,"Y aquí se puede comer no, no, no contestaste"
0:00:18,0:00:24,Patricia,"Yo me dio susto, me dio susto yo la pregunté, pero mejor, digo a lo mejor la veo hoy pero estaba un poco asustada"
0:00:24,0:00:30,SPEAKER_09,"Yo la vi, lo encontró acá y se me hizo, como se dice se me hizo la boca agua"
0:00:30,0:00:32,Patricia,Se me hizo la boca agua
0:00:32,0:00:34,SPEAKER_09,"No, se me hizo así"
0:00:34,0:00:40,Patricia,"Al contrario, amarga la boca agua no, no, no, porque si no contestas que no, no va a decir que no"
0:00:40,0:00:42,SPEAKER_09,Pero quizás
0:00:42,0:00:46,Patricia,"Si, vale está informada, no?"
0:00:46,0:00:48,SPEAKER_09,"Si, es lo mas importante"
0:00:48,0:00:54,Patricia,"Quizás no va a venir a la celebración ah, no creo creo que no"
0:00:54,0:01:00,SPEAKER_09,"Es que a veces tienen reuniones, los martes tienen una reunión si, martes y..."
0:01:00,0:01:06,Patricia,"No ah, ya, si que tiene reunión, por eso anda por aquí todo bien"
0:01:12,0:01:14,SPEAKER_05,"Oh, para comer"
0:01:14,0:01:32,Patricia,"Si, si, si lo que tenemos luego que dejarlo como lo encontramos eso si y también ya llevar todo lo que lo que tenemos aquí que nos podemos llevar si algo no podemos llevar, pues lo dejamos para mañana, pero si podemos llevar eso es nuestro algo?"
0:01:32,0:01:34,Belén,"No, no es nada"
0:01:34,0:01:36,SPEAKER_05,It's not our stuff.
0:01:36,0:01:38,Belén,No nos queda nada
0:01:38,0:01:40,Patricia,No queda nada? solo esto?
0:01:40,0:01:42,Belén,"Tenemos algunas cosas, pero llevamos mucho"
0:01:42,0:01:46,Patricia,Entonces mañana el resto creo que Manuel bajó todo
0:01:46,0:01:50,SPEAKER_01,Quedaron cosas ahí? Quedaron los libros y se subieron algunas cajas
0:01:50,0:02:04,Patricia,"Los libros, porque mañana vamos a darlos si, están las bolsas que podemos poner dentro un libro hi, Jeremy, y compañía el libro y el puti"
0:02:06,0:02:08,Joe,"Si, tenemos los libros"
0:02:08,0:02:10,Patricia,"Y el certificado, se lo damos en la mano y luego"
0:02:10,0:02:12,Joe,Los certificados y los libros están aquí
0:02:12,0:02:34,Patricia,"Están preciosos los certificados quedaron muy bonitos están como plastificados están muy bonitos si, ya están pero no es mucho su trabajo por eso yo la digo muy amablemente pero es que no nos funciona la impresora de color de la oficina marín!"
0:02:34,0:02:36,Joe,Que pasa?
0:02:36,0:02:50,Patricia,"Nos vemos mañana, eh? Comemos unos tamales nos dices adiós o no? Dinos adiós she is visiting le gustas?"
0:02:50,0:02:52,None,Buscando algo
0:02:56,0:02:58,SPEAKER_09,Y el color?
0:02:58,0:03:00,Joe,The color?
0:03:00,0:03:02,SPEAKER_05,"Ok, bye Marín [laughing]"
0:03:04,0:03:14,Belén,Espero que lo he pronunciado correctamente pero Manuel también y Belén y yo te pregunté al no peña
0:03:14,0:03:56,Patricia,Madre mia estaba tan ocupado... es que está complicado con iMovie... y a la vez había niños escribiendo pero bien luego Manuel se puso a hacer uno de ellos porque Manuel no había probado hacerlo
0:03:56,0:04:06,SPEAKER_01,"No, si, para ahora no pero oficialmente todos los posteadores habían dicho yo ayudarlo un poquito pero nunca habían hecho uno yo solo"
0:04:08,0:04:10,Patricia,Pero hay que hacer el hands on
0:04:10,0:04:12,Joe,Porque la gente no se aprende
0:04:12,0:04:14,SPEAKER_01,Ya sabían los otros
0:04:14,0:04:16,Joe,Y yo solo
0:04:16,0:04:20,Belén,Y Racelyn y Lucas
0:04:20,0:04:24,Joe,Y Lucas no?
0:04:24,0:04:30,Patricia,Yo siempre me sentía así como teaching es que siempre mil cosas a la vez
0:04:30,0:04:36,Belén,Pero Lucas también lleva mucho tiempo... haciendo cada paso
0:04:36,0:04:38,Patricia,Y Joe se mantenía en español
0:04:40,0:04:42,Joe,"Un poco, más o menos"
0:04:42,0:05:00,Patricia,Si porque cuando uno está más haciendo mil cosas a la vez como que se olvida eso si se mantuvo ahí que notamos? Que quieres decir un poco porque tu trabajaste con varios niños en lo de añadir el sonido como fue?
0:05:00,0:05:14,Joe,"Fue muy bien, algunos no quieren hacer como jaden y Nathan no se porque pero también jaden y Nathan no querían no querían, no"
0:05:14,0:05:16,SPEAKER_02,Y Kelly si
0:05:16,0:05:34,Joe,"Kelly si kelly pero Kelly se le dieron un poco no agradó nada si con Chloe y Liz hicimos fue Chloe, lo siento"
0:05:34,0:05:38,Belén,Chloe y Kelly y Liz y Sofía
0:05:38,0:05:42,Joe,"Liz y Sofía, si hicieron un audio"
0:05:42,0:05:44,Patricia,En el iMovie
0:05:44,0:05:48,Joe,Un pequeño script 2 lines
0:05:48,0:05:50,Patricia,En la tarjeta
0:05:50,0:05:56,Joe,Si fuimos a upstairs para grabarlo
0:05:56,0:05:58,Patricia,Para que no hubiera tanto ruido
0:05:58,0:06:00,Joe,Fue muy divertido
0:06:00,0:06:04,Patricia,"Lo escribieron y luego lo grabaron no, solo dicen otra vez"
0:06:04,0:06:06,SPEAKER_05,"Con el iMovie, how was that"
0:06:06,0:06:20,Joe,"Bien no hay muchas opciones para audio no hay """"scream"""" cosas así pero otra vez that was the only problem I ran into"
0:06:20,0:06:22,?,Somebody wanted the scream
0:06:22,0:06:24,SPEAKER_09,You could have provided the scream
0:06:24,0:06:26,Joe,I didn't think about that till later
0:06:26,0:06:34,SPEAKER_09,"Like you could do it, like and you get home, and are like, """"ahh!"""" [laughter]"
0:06:34,0:07:04,Patricia,"That's what Jordani was doing he was like, """"cough cough"""", like His voice was like noises, """"Paf, uh, iiih."""" Pero lo difícil fue que nosotros estábamos usando el teléfono, no iMovie entonces el vio la película y luego sin ver la película tuvo que grabar el sonido entonces era como me miraba como cuanto tiempo espero pero no al mismo tiempo"
0:07:04,0:07:16,Joe,Si es el mismo con iMovie no podemos en iMovie tampoco porque tenemos que salir de iMovie a Voice memos y a grabar
0:07:16,0:07:18,Patricia,Pero en iMovie tiene que haber algo que añades
0:07:18,0:07:26,Belén,"Yeah, we have... the one I used with Dariel, It has a little microphone if you wanted to record something."
0:07:26,0:07:28,Patricia,"Claro, está integrado."
0:07:28,0:07:42,Belén,"And you can add pictures.. yes, and we had like... I found like a source of sounds. Como la campana y ya lo he agregado"
0:07:42,0:07:44,Patricia,So you were working with iMovie?
0:07:44,0:07:50,Belén,Yeah. We tried all the sounds. Who was this?
0:07:50,0:07:52,Patricia,Dariel
0:07:52,0:08:02,Belén,"We heard all sounds. They were all laughing because there was one school bell. So it was like, """"ahhh"""""
0:08:02,0:08:04,Joe,I didn't know you could record in iMovie.
0:08:04,0:08:30,Belén,And... and he added... he was very specific of the sounds that he added and thankfully i found those. So... he wanted a... y...
0:08:36,0:08:42,Patricia,So you already have it in your phone? You were using the iPad?
0:08:42,0:08:44,None,Yeah.
0:08:44,0:08:48,Patricia,"And then you uploaded it. Ah, you uploaded it to the drive."
0:08:48,0:08:50,Belén,Yeah
0:08:50,0:08:52,Patricia,"Oh, wow! That's great!"
0:08:52,0:08:54,None,"Yeah, you can either airdrop it to me"
0:08:56,0:09:04,Joe,"Yeah, if anyone has any you can either airdrop it to me or upload or airdrop to me."
0:09:04,0:09:08,Belén,I didn't know how to use it so we learned together.
0:09:08,0:09:14,Joe,"Manuel, did you use mine? Oh, you used mine for the animation. for the animation."
0:09:14,0:09:18,Patricia,"Oh, he used yours. Because you don't have it in your phone?"
0:09:18,0:09:28,SPEAKER_00,"No, because I wasn't sure if I had enough memory. My phone was using full of memory so I forgot to delete it. I wasn't sure if it was going to cap or if it was going to be all I can't take note of."
0:09:28,0:09:32,Patricia,"I renamed it, though, I think. I wrote both."
0:09:32,0:09:34,Joe,Jordani's story sounds.
0:09:34,0:09:50,Patricia,"Yeah, Jordani has sounds so there's an audio for Jordani. But I don't know how it's going to work. And then Lucas didn't want to... he created his great movie. But then he didn't want to record. So you have Lucas in yours and I named it."
0:09:50,0:09:52,Joe,It didn't say that it was accepted.
0:09:52,0:10:02,Patricia,He wasn't happy with the speed so we took one snapshot of each one of each one but we explored how to slow it down and he was happy with three.
0:10:02,0:10:04,Joe,Speed three.
0:10:04,0:10:14,Patricia,But he didn't want to add any sound any sound because this person was going into the store and then leaving the store with the video game and then he was going home to play the video game.
0:10:14,0:10:22,Joe,Was he just thinking dialogue as sound? Because you could do footsteps or other things like that. But he didn't suggest anything like that.
0:10:22,0:10:24,Patricia,"He didn't seem interested in adding anything, but he told me the story"
0:10:24,0:10:46,Joe,"Y eso fue todo tal vez tenga una imaginación más grande cuando vea a todos los demás and I think tomorrow, after we watch them, I'm going to be like if you guys want to get this on your phone i don't know how to say download an application. [spanish] ¿bajar? ¿una aplicación? ¿es gratis?"
0:10:46,0:10:48,Patricia,¿podríamos mandarle a cada papá su aplicación por whatsapp?
0:10:48,0:11:00,Joe,"Sí, podemos mandarlo un link con todos los películas pero también si quieren crear más películas para usar la aplicación"
0:11:00,0:11:02,Patricia,Digamos uno de los papás
0:11:02,0:11:04,Patrica,Pobre papás
0:11:04,0:11:10,Belén,¿habían algunos que me preguntaron que habían hecho la película porque querían hacer otra pero en casa?
0:11:10,0:11:14,Joe,"Sí, es que yo dije a muchos"
0:11:14,0:11:16,Patrica,Digamos uno de los papás
0:11:16,0:11:22,Joe,"Sí, yo pregunté hoy pero nadie entiende porque los test"
0:11:22,0:11:30,Patrica,Si pudiéramos añadir en la PowerPoint la imagen o enseñarlo en el teléfono ese icon
0:11:30,0:11:32,Joe,Icon y nombre de la aplicación
0:11:32,0:11:34,Patricia,Porque es super sencillo de usar
0:11:34,0:11:38,Joe,Voy a hacer un loop entonces puede ser al fin
0:11:38,0:11:50,Patricia,"Al final eso alright sí, pero estuvo interesante con Israel Israel tenia muy bonitos muy bonitos muñequitos"
0:11:50,0:12:06,SPEAKER_01,Sí estuvo mucho tiempo a pesar que no estuvo tanto tiempo pero la mayoría de una clase estuvo un poquito molesto porque se secaron y no se pueden mover mucho pero lo logró todavía arreglar
0:12:06,0:12:26,Patricia,Perdieron flexibilidad al secarse y se quedó así no estaba contento con eso si hoy tenía un día me dijo que no estaba muy bien por varias cosas así que y Jordani casi se me rompió el corazón destruyó su Mario sí
0:12:26,0:12:28,Joe,"Claro, bueno, un parte"
0:12:28,0:12:30,Patrica,Paramos un momento y digo
0:12:30,0:12:36,Patricia,"Y ahora qué pasa ahora tengo que destruir Mario. Pero no dudó, he didn't hesitate, he went and destroyed the Mario."
0:12:36,0:12:38,SPEAKER_07,Was it part of the plan?
0:12:38,0:12:58,Patricia,"I was like, I hope that it's a part of the cuento. Yeah, part of the plan was that there was a ball that fell on Mario and destroyed it. There was one friend that had his hand but the Mario is there. So you can see the Mario and then it's destroyed. The ball comes and destroys the Mario. But then the head moves by itself."
0:12:58,0:13:10,Joe,"Ah si, muy bien. Tambien, el dice que part of the reason that Mario was a little damaged at the beginning he told me is because he had just been fighting he had just been fighting someone else."
0:13:10,0:13:12,SPEAKER_07,I don't remember
0:13:12,0:13:18,Patricia,He's fighting in the whole movie. The whole movie. He's always fighting
0:13:18,0:13:34,Group,*Noisy chatter*
0:13:46,0:13:50,Joe,Sorry Kevin sometimes I feel sorry for Kevin
0:13:50,0:13:56,Patricia,Como que son personas pero no son personas pero como que están
0:13:56,0:14:00,SPEAKER_07,"Eso me gusta siempre no, no olvide él"
0:14:00,0:14:02,Belén,Hi Kevin
0:14:02,0:14:20,Patricia,"How about the rest? This is what we were doing in that room. Anything else? Anything about the attitude? Anything that you learned? How did that go? Did you finish? No, por supuesto"
0:14:20,0:15:08,SPEAKER_02,"I did the first one with Nathan. Janina. We didn't do the first one because she was not here. Because she was not here. She was excited, so I felt bad saying no. And jayden with Nathan and Jaden the answers were pretty much the same. Nathan said the thing that I remember that he changed i remember that he changed is that he likes to read at home. He likes to read at home. Alone. When he has free time. Because he knows that helps him to be a stronger reader. But then besides that he said the same that he said in the first one."
0:15:08,0:15:12,Patricia,Great. Did you end up doing any?
0:15:14,0:15:28,SPEAKER_07,Yes. And Kaylee racelyn pero there are two more and someone else. Novani
0:15:40,0:15:44,SPEAKER_05,Yes. Sometimes they change their opinion. They ask why. You have to ask a lot.
0:16:10,0:16:12,Patricia,"In itself, the tool is not very good."
0:16:12,0:16:44,SPEAKER_07,"But it's a bit the same. At home, your mom forces you to read. Y dijo que no le gusta leer sola. ¿qué más? Sí, cuando cambiaban un poco de la respuesta, le preguntaba por qué y escribí ahí pero es difícil en aquí un poco revuelto es muy difícil porque ella en sí es como un poco entonces a Kaylee es mejor salir de la aula y sentarse"
0:16:44,0:16:48,SPEAKER_06,"Sí, allí estaba más en silencio sí, aquí era muy"
0:16:50,0:16:54,SPEAKER_07,Porque había muchos aleana no estaba
0:16:54,0:16:56,None,"Sí, cuando estaba enferma"
0:16:56,0:17:04,SPEAKER_06,En la cimitacruz sí estaban así Israel y Jordán que querían jugar con la pelotita
0:17:04,0:17:06,SPEAKER_05,Y Israel dándole con la cabeza
0:17:06,0:17:08,SPEAKER_01,Y yo estaba asustado
0:17:08,0:17:10,Patricia,Ella tiene que buscar su lente
0:17:10,0:17:16,Patrica,"Adelante, adelante adelante, claro vino buscando sus lentes"
0:17:16,0:17:18,?,¿cómo se ven sus lentes?
0:17:18,0:17:22,SPEAKER_09,¿cómo se ven Marín? ¿de qué color son? ¿de qué color son?
0:17:22,0:17:26,Belén,Are they in a box? Were they in a box?
0:17:26,0:17:30,None,"No, they were alone"
0:17:30,0:17:32,SPEAKER_09,"No, no"
0:17:32,0:17:38,SPEAKER_05,Cuéntanos que te ayudamos a encontrarlos ella estaba buscando algo did anyone see her glasses?
0:17:38,0:17:40,Belén,"No, no"
0:17:40,0:17:42,None,"No, no"
